artist_name,painting_name,year,context,location,slug
Jean-Honoré Fragonard,The Love Letter,1770,"Jean-Honoré Fragonard, a leading figure in the Rococo movement, painted 'The Love Letter' circa 1770 during a time marked by the opulence and elegance of the pre-Revolutionary French court. Rococo, characterized by its light-heartedness, ornate details, and use of pastel colors, reflected the tastes of the aristocracy for intimate and playful scenes. 'The Love Letter' embodies these qualities, depicting an elegantly dressed woman amidst sumptuous surroundings, receiving or composing a letter that suggests themes of love and intrigue. Fragonard was inspired by the hedonistic and decorative art prevalent in the rococo salons, where art often focused on themes of romance and leisure. His expertise in rendering textures and using light imbues the painting with a sense of immediacy and vibrancy. The painting is significant in art history as it showcases Fragonard's mastery of brushwork and his ability to convey narrative through expressive yet graceful compositions. Technically, it illustrates his skill in employing loose brushstrokes to capture the textures of fabrics and furnishings, which help create a palpable sense of intimacy. This artwork not only reflects the preferences of its time but also offers insight into the social dynamics and leisurely pursuits of the 18th-century French elite.","The Metropolitan Museum of Art, New York, USA",the-love-letter
Jean-Honoré Fragonard,A Young Girl Reading,circa 1770,"Jean-Honoré Fragonard's 'A Young Girl Reading' encapsulates the Rococo style's whimsicality and charm. Created circa 1770, during the reign of Louis XV, the Rococo movement was characterized by its ornate, playful qualities that provided a counterpoint to the more austere Baroque period that preceded it. Fragonard was known for his light-hearted themes, and this painting is a perfect example of his ability to capture intimate, everyday moments with elegance. The painting features a young girl absorbed in her reading, embodying the Rococo fascination with leisure and intellectual pursuits. Notable is Fragonard’s use of soft, vivid colors and fluid brushstrokes, which create a sense of immediacy and intimacy. The girl's calm expression and relaxed posture reflect the period's interest in individual emotion and personal exploration. Technically, Fragonard excelled in rendering textures, visible in the delicate folds of the girl's yellow dress and the rich background tones. The painting is significant as it highlights the period's cultural emphasis on literature and education among the emerging middle class, mirroring the Enlightenment's intellectual climate. 'A Young Girl Reading' thus reflects not just the whimsical escape of Rococo art but also its deeper appreciation of personal and intellectual refinement.","National Gallery of Art, Washington D.C., USA",a-young-girl-reading
Jean-Honoré Fragonard,The Progress of Love: The Meeting,1771-1773,"Jean-Honoré Fragonard created 'The Progress of Love: The Meeting' between 1771 and 1773 as part of a series of four panels commissioned by Madame du Barry, the last mistress of King Louis XV. Fragonard, one of the leading artists of the Rococo movement, crafted this work during the height of the movement's popularity, characterized by its elaborate ornamentation, pastel colors, and themes of romance and whimsy. This painting embodies the Rococo style through its lush, idyllic setting and the intimate subject matter reflecting the romantic escapades favored by the French aristocracy. The panel captures a clandestine meeting between lovers, set against a theatrically lush garden that emphasizes sensuality and playful elegance. Although originally intended for Madame du Barry’s pavilion at Louveciennes, the commission was ultimately rejected, likely due to a change in artistic tastes toward Neoclassicism and political shifts. The series eventually ended up in the hands of Fragonard's descendants before being divided over time. Fragonard’s delicate brushwork and the use of light enhance the narrative and emotional depth, marking the work as a quintessential example of Rococo art. The painting stands as a testament to both the artist's masterful technique and the complex social dynamics of pre-revolutionary France.","The Frick Collection, New York, USA",the-progress-of-love-the-meeting
Wassily Kandinsky,Composition VII,1913,"Created in 1913, Wassily Kandinsky's 'Composition VII' is a pivotal work in the development of abstract art, representing a culmination of his exploration of color, form, and spirituality. Kandinsky's inspiration stemmed from Theosophy and his belief in synesthesia—the ability to translate music into visual arts—which led him to see painting as an expressive language akin to music. 'Composition VII' exemplifies these ideas through its vivid color palette, dynamic movement, and non-representational forms, indicating a departure from traditional representational art. This work, composed in just four days, reflects his fascination with apocalyptic themes and conveys a sense of chaos and transformation. It is considered a masterpiece of the Expressionist movement and demonstrates his innovative use of color theory and spatial organization that influenced subsequent abstract artists. Created just before World War I, the painting captures a transitional moment in history when many artists began questioning established norms, mirroring the broader societal upheavals of the time. Kandinsky's techniques, such as layering colors and overlapping shapes, pushed the boundaries of conventional painting, contributing significantly to art's evolution towards abstraction.","The State Tretyakov Gallery, Moscow, Russia",composition-vii
Wassily Kandinsky,Improvisation 28,1912,"Wassily Kandinsky's 'Improvisation 28' (1912) represents a pivotal moment in art history as it embodies the shift towards abstraction in early 20th-century painting. Created during a time of significant social and cultural upheaval, the work reflects the influence of spiritual and philosophical ideas, particularly Theosophy and the concept of synesthesia, where colors and shapes were linked to emotions and music. Kandinsky was an important member of the Blue Rider group, which sought to transcend representational art to explore spiritual realities. 'Improvisation 28' showcases Kandinsky's innovative use of vibrant colors, dynamic brush strokes, and abstract forms to evoke the sensation of music, marking a departure from traditional art forms. Its significance lies in its pioneering role in the development of Abstract Expressionism, challenging the conventions of Western art and influencing generations of artists. The painting's abstract nature allowed viewers to experience the artwork on an emotional level, emphasizing personal interpretation and subjective experience, which were radical notions at the time.","Solomon R. Guggenheim Museum, New York, USA",improvisation-28
Wassily Kandinsky,Composition VIII,1923,"Created in 1923, Wassily Kandinsky's 'Composition VIII' is a pivotal work within the abstract art movement, executed during his Bauhaus period in Weimar, Germany. This period marked a shift towards geometric abstraction, a style characterized by its use of bold colors, lines, and shapes. Inspired by the theoretical exploration of synesthesia and the emotional resonance of colors and forms, Kandinsky sought to evoke the spiritual and emotional essence of music within visual art. 'Composition VIII' marks a culmination of Kandinsky's exploration of abstraction, with its chaotic yet harmonious arrangement of geometric forms and vibrant colors. It reflects his belief in achieving a visual harmony analogous to a symphony, hence his frequent use of musical titles. The painting carries significant art historical importance as it represents a mature phase in Kandinsky's career, illustrating his influence on the development of abstract art and his contribution to the modernist movement. The painting's creation also coincides with the post-World War I atmosphere, where modernists sought new means of expression against the changing social and political backdrop.","Solomon R. Guggenheim Museum, New York, USA",composition-viii
Wassily Kandinsky,Yellow-Red-Blue,1925,"""Yellow-Red-Blue,"" painted in 1925, signifies a pivotal period for Wassily Kandinsky as he delved into his theoretical exploration of color and form relationships. By this time, Kandinsky had become a leading figure in the Bauhaus movement, where he influenced modern design principles and avant-garde art. The painting exemplifies his commitment to abstraction, using primary colors as a primary mode of expression to convey pure emotion. Significant are the technical innovations seen in Kandinsky's use of geometric forms and dynamic composition, indicating a departure from representational figures to focus on emotional resonance and spiritual experience, inspired by synesthetic theories. The cultural backdrop of post-World War I Europe, particularly the progressive ideas emerging from the Bauhaus school in Germany, played an integral role. Through this work, Kandinsky effectively captured the essence of his theoretical pursuits in 'Concerning the Spiritual in Art,' solidifying his position as a pioneer in non-objective art and significantly impacting the development of modern abstract painting.","Musée National d'Art Moderne, Centre Georges Pompidou, Paris, France",yellow-red-blue
Wassily Kandinsky,Several Circles,1926,"Wassily Kandinsky's 'Several Circles,' painted in 1926, is emblematic of his exploration into pure abstraction during his period with the Bauhaus School. Kandinsky, a pioneer of abstract art, was deeply influenced by the spirituality of art, often drawing parallels between visual form and musical composition. 'Several Circles' represents a significant departure from representational art, focusing on the emotive potential of colors and geometric forms. The painting is particularly notable for its use of overlapping circles in varying shades, each circle meticulously placed to create a harmonious dynamic. The simplicity of circles allowed Kandinsky to delve into complex symbolisms, representing unity and wholeness. The work reflects his interest in theosophy and his belief in the transcendental power of art to convey deeper truths. This painting exemplifies Kandinsky's theoretical ideas about the synesthetic possibilities in art, where visual art could emulate the temporal flow of music. Created during his tenure at the Bauhaus School in Dessau, the painting benefits from the institutional support for experimental and avant-garde art that characterized the school. 'Several Circles' holds an important place in art history as it advances the movement towards abstraction in modern art, influencing future generations of artists in their pursuit of non-representational form.","Solomon R. Guggenheim Museum, New York, USA",several-circles
Edvard Munch,The Scream,1893,"Edvard Munch's 'The Scream', painted in 1893, is an iconic work emblematic of the Symbolist movement and a precursor to Expressionism. The painting captures an intense emotional experience that Munch described as ""a scream through nature"". The haunting figure with a distorted face, set against a tumultuous sky, conveys deep anguish and existential dread, reflecting the psychological preoccupations of the fin de siècle period. Munch was inspired by a personal experience in Oslo, where he felt an overwhelming sensation of sadness during a walk at sunset, which he vividly translated into this composition. Technically, 'The Scream' is notable for its swirling lines and bold color contrasts, emphasizing the subject's emotional state. The use of tempera and pastel on cardboard allowed Munch to achieve vivid effects that enhance the painting's vibrancy and texture. As a cultural symbol, 'The Scream' resonated widely, articulating the universal anxiety of the modern age. It challenged contemporary understandings of portraiture and landscape, becoming an enduring symbol of human angst. This has made it a pivotal work that has influenced countless artists and remains central to discussions on expression in art.","The National Gallery, Oslo, Norway",the-scream
Edvard Munch,Madonna,1894,"Edvard Munch's painting 'Madonna' was created in 1894 during a period marked by his exploration of deep psychological themes, influenced by Symbolism and Post-Impressionism. Munch was inspired by themes of love, anxiety, and existential reflection. 'Madonna' portrays a sensual and ethereal figure rendered in fluid lines and a dreamlike color palette, reflecting Munch's interest in the emotional and symbolic potential of human forms. The painting's innovative use of color and form captures vibrant psychological expressions and embodying the timeless allure of femininity. It was controversial at the time due to its erotic and unconventional portrayal of religious imagery, symbolizing the union of life and death—a central theme in Munch's work. Munch's exploration of the human psyche, alongside contemporaries like Van Gogh and Gauguin, significantly influenced the development of Expressionism in the 20th century, cementing the painting's importance in art history as a precursor to modern expressions of existential angst and emotion.","Nasjonalmuseet, Oslo, Norway",madonna
Edvard Munch,The Dance of Life,1899-1900,"""The Dance of Life"" by Edvard Munch was painted between 1899 and 1900 during a period of profound personal exploration and artistic development. This painting is part of Munch's 'Frieze of Life' series, which examines themes of love, anxiety, and death—central concerns in Munch's oeuvre. Drawn from his Symbolist phase, this work reflects Munch’s interest in representing the emotional and psychological layers of human experiences, particularly those related to love and existential reflection. Munch was deeply influenced by his own experiences with illness and death, as well as the broader currents of modernism and existential philosophy that were emerging in Europe at the time. The painting is notable for its swirling forms, expressive use of color, and dream-like quality, all hallmarks of Munch’s distinctive style. Thematically, it encapsulates the cycle of life, with figures representing different stages of a woman's life, choreographed into a dance that symbolizes life's ephemeral nature. Technically, Munch employed fluid, sinuous lines and a pictorial style that prefigures elements of Expressionism, which he greatly influenced. The painting is significant in art history for its exploration of universal human themes through a deeply personal lens, leaving a lasting impact on the development of expression in modern art.","National Museum, Oslo, Norway",the-dance-of-life
Edvard Munch,The Sick Child,1885,"""The Sick Child"" is a pivotal work by Edvard Munch, completed in 1885-86, marking a significant departure toward a mature style influenced by Symbolism. This painting is deeply autobiographical, inspired by the death of Munch's elder sister, Johanne Sophie, from tuberculosis. The emotional rawness and innovative technique, featuring loose brushwork and a striking use of color and light, reflect the artist's grief and existential contemplation. It represents a shift toward expressionism, characterized by a focus on emotion over realism. The painting's blurred lines and ethereal quality, achieved through repeated scraping and reworking, emphasize the fragility and impermanence of life, foreshadowing themes prevalent in Munch's later work. Its portrayal of mortality, vulnerability, and familial loss resonates with the Symbolist movement's exploration of psychological depth. The painting holds a crucial place in art history as an early example of emotionally-driven experimentation, paving the way for future avant-garde movements and establishing Munch as a central figure in the transition from 19th-century naturalism to modern expressionism.","Nasjonalmuseet, Oslo, Norway",the-sick-child
Edvard Munch,The Vampire,1893,"'The Vampire,' painted by Edvard Munch in 1893, is part of his 'Frieze of Life' series which examines themes of love, angst, and death. Munch was inspired by the Symbolist movement and his personal hardships. Born from an intense, expressive painting style, 'The Vampire' showcases a woman embracing a man, her hair flowing like blood, embodying the blend of attraction and danger. This scene reflects Munch's fascination with complex human emotions and relationships. The painting is executed with vigorous brushstrokes, typical of Munch, creating a sense of urgency and emotional depth. In art history, the work is significant as it diverges from naturalism, moving towards a more emotional form of expression, influencing the later development of Expressionism. Culturally, Munch's paintings have been an exploration of psychological interiors, prefiguring the explorations of the mind that would dominate much of 20th-century art and literature. The historical context of Munch's personal life, marked by familial loss and mental distress, profoundly impacts the interpretation of this painting, as it encapsulates his view of love as both seductive and destructive.","Munch Museum, Oslo, Norway",the-vampire
Jules Breton,The Gleaners,1857,"'The Gleaners,' created by Jean-François Millet in 1857, is one of the most significant works highlighting the life of peasants during the mid-19th century. The painting depicts three peasant women gleaning a field of stray grains of wheat after the harvest. Primarily associated with the Realism movement, Millet's work draws attention to the rural working class and their harsh realities, a subject often neglected by art at that time. His sympathetic portrayal of these women serves to dignify their labor, contrasting with earlier depictions that focused more on the idyllic landscapes or heroicizing farmers. This work was initially met with criticism from upper-class audiences in France who felt uncomfortable with its subject matter, but it has since been recognized for its powerfully poignant social commentary. Its muted color palette and soft brushwork are characteristic of Millet's style, emphasizing the blend of human figures with the earth's tones, suggesting a unity with nature. The painting's composition, focusing attention on the back-breaking labor of gleaning, highlights the struggle and endurance of the working poor, serving as a visual document of rural life in 19th-century France.","Musée d'Orsay, Paris, France",the-gleaners
Jules Breton,The Song of the Lark,1884,"""The Song of the Lark"" by Jules Breton was completed in 1884 and exemplifies the artist's dedication to depicting rural life in a poetic and idealized manner. Created during the late 19th century, a period marked by rapid industrialization and urbanization, Breton's work stands as a testament to the nostalgic longing for pastoral life. The painting captures a peasant girl standing in a sunlit field, listening to the melodious song of a distant lark at dawn. Its significance in art history is profound as it bridges the gap between realism and romanticism, offering a glimpse into the rural idealism that Breton cherished. Technically, the painting is notable for its use of light and color to convey the early morning atmosphere and the emotions of the subject. Breton's meticulous attention to detail and his ability to evoke serenity and introspection through his compositions make this piece an enduring favorite. The cultural circumstances of its creation reflect a period where artists were increasingly drawn to themes of nature and rural simplicity, diverging from the contemporary societal changes brought by the Industrial Revolution.","Art Institute of Chicago, Chicago, United States",the-song-of-the-lark
Jules Breton,The End of the Working Day,1886,"Jules Breton, a pivotal figure in the Realist movement, painted 'The End of the Working Day' in 1886. The painting depicts laborers returning home after a day’s work, encapsulating the essence of rural life in 19th-century France. Breton’s work was heavily inspired by the social and economic landscape of the time, characterized by the Industrial Revolution and a growing urban-rural divide. His paintings deeply resonated with contemporary concerns about industrialization and its impact on traditional lifestyles. Inspired by his upbringing in a rural community, Breton's motif of celebrating peasant life aimed to elevate everyday workers to subjects worthy of fine art. Breton’s meticulous attention to detail, naturalistic depiction of light, and his empathetic portrayal of his subjects added a dignified beauty to the everyday acts of labor. 'The End of the Working Day' epitomizes the technical mastery and social consciousness of Breton's work, thus holding significant importance in capturing the zeitgeist of its era. This painting stands as a social document and a celebration of agrarian existence, often regarded as an empowering representation of common people in the face of industrial change.","Brooklyn Museum, New York, USA",the-end-of-the-working-day
Jules Breton,The Weeders,1868,"Jules Breton completed 'The Weeders' in 1868, during a period when Realism was the prevalent artistic movement. The painting reflects Breton's deep interest in the rural life of his native France, specifically the Pas-de-Calais region. It depicts peasant women laboring in the fields, capturing the dignity and hardship of agricultural work. This work aligns with the broader Realist ethos of portraying everyday life with honesty and dignity, countering the idealized subjects of earlier Romanticism. Breton was inspired by the writings of contemporary authors like Émile Zola and Gustave Flaubert, who also focused on the realities of rural and working-class life. Technically, Breton's careful attention to light and atmosphere imbues the scene with a poignant beauty, while his use of meticulous detail enhances the realism and humanism of the piece. 'The Weeders' is significant in art history as it underscores the shift towards social consciousness in art, as artists increasingly depicted the toils and lives of ordinary people. This painting serves as a prime example of Breton’s commitment to this cause, earning him considerable acclaim both in France and internationally.","Metropolitan Museum of Art, New York, USA",the-weeders
Jules Breton,The Feast of Saint John,1875,"Created in 1875, Jules Breton's 'The Feast of Saint John' embodies the 19th-century Realist movement which sought to depict everyday life with a focus on rural scenes. Breton, known for his evocative portrayals of peasant life, was inspired by the traditional fête de la Saint-Jean, a midsummer celebration in France. The painting captures the vibrant community spirit and cultural customs of French rural life, featuring villagers participating in the joyous event illuminated by bonfires. Breton's meticulous attention to detail and use of light reflects the influence of both the academic traditions and the burgeoning Impressionist movement. His ability to convey warmth and the nuances of light to evoke emotion situates 'The Feast of Saint John' not only as a vivid cultural record but also as a bridge between academic art practices and modern innovations. This work contributed significantly to the appreciation of rural subjects in fine art, thus influencing future generations of painters who sought authenticity and nobility in depicting everyday life.","Musée des Beaux-Arts, Arras, France",the-feast-of-saint-john
Édouard Manet,Olympia,1863,"Édouard Manet completed 'Olympia' in 1863 during a pivotal era in art history marked by the shift from traditional academic art to modernism. Manet was inspired by Titian's 'Venus of Urbino,' substituting Titian's idealized Venus with a contemporary Parisian courtesan, thus engaging with and challenging both classic and modern norms. Notable for its candid depiction of a nude woman, 'Olympia' defies traditional representations by portraying her with a bold gaze, suggesting both autonomy and defiance. The painting’s reception was initially controversial due to its stark realism, flat brushwork, and the confrontational demeanor of the subject, which differed from the romanticized nudes typical of the era. This piece is considered one of the foundational works of modern art as it breaks from the Renaissance-inspired techniques and introduces a new visual language. 'Olympia' thus holds significant cultural and historical importance, marking a shift towards modernism and influencing subsequent generations of artists, including the Impressionists, who admired Manet’s use of light and realist portrayal of themes.","Musée d'Orsay, Paris, France",olympia
