artist_name,painting_name,year,context,location,slug
Johannes Vermeer,The Milkmaid,1658,"Johannes Vermeer painted 'The Milkmaid' circa 1658 during the Dutch Golden Age, a period renowned for its remarkable cultural and artistic accomplishments. Vermeer was part of the Delft school of painting and is celebrated for his masterful use of light, color, and composition. 'The Milkmaid' depicts a domestic maidservant absorbed in the task of pouring milk, encapsulating the theme of everyday life with an extraordinary sense of tranquility and stillness. The painting exemplifies Vermeer's use of natural light and meticulous attention to detail, with each element—a loaf of bread, the shiny glaze of a jug, the texture of the maid's attire—painstakingly rendered to convey realism and intimacy. This work stands out for its exceptional use of color and light, particularly the subtle interplay on the maid's face and hands, promoting the notion of quiet dignity and simplicity in daily routines. 'The Milkmaid' not only reflects Vermeer's technical prowess but also encapsulates the cultural significance of household scenes in 17th-century Dutch art, which often symbolized moral virtues like humility and industry. Its beauty and precision make it a significant work in the history of Western art, illustrating Vermeer's genius at transforming simple subjects into timeless and profound compositions.","Rijksmuseum, Amsterdam, Netherlands",the-milkmaid
Johannes Vermeer,View of Delft,1660-1661,"Johannes Vermeer painted 'View of Delft' around 1660-1661 during the Dutch Golden Age, a period characterized by great cultural, economic, and artistic flourishing in the Netherlands. Vermeer's works are noted for their exquisite use of light and perspective, and this painting exemplifies his mastery in depicting urban scenes with clarity and precision. It is one of the few landscapes he produced, and it showcases a realistic view of Delft, his hometown. The painting is celebrated for its serene and detailed rendition, capturing the city’s architectural features, light reflection on water, and atmospheric sky. 'View of Delft' is significant as it deviates from the domestic interiors for which Vermeer is most known, focusing instead on a cityscape that conveys a sense of tranquility and stability during a time of prosperity in the city. It also represents innovative techniques of perspective and light reflection, characteristic of Vermeer's style, and serves as a testament to his ability to infuse ordinary scenes with depth and significance. Cultural and historical circumstances include the thriving mercantile culture of the Dutch Republic and the increased demand for art to decorate the homes of the wealthy bourgeoisie.","Mauritshuis, The Hague, Netherlands",view-of-delft
Johannes Vermeer,Woman Holding a Balance,1664,"Johannes Vermeer, a master of Dutch Baroque painting, created 'Woman Holding a Balance' around 1664 during the Dutch Golden Age. This period was marked by economic prosperity and cultural bloom in the Netherlands, with a significant focus on genre paintings that depicted domestic scenes. Vermeer's work is notable for its intense realism and masterful treatment of light and detail. In 'Woman Holding a Balance,' he captures a moment of quiet introspection as a woman delicately holds a balance, with a Last Judgment painting in the background. This juxtaposition may symbolize moral and ethical considerations of life, the balance between material and spiritual worlds, or personal reflection on one's actions. The composition reflects Vermeer's mastery in using light to convey calmness and spatial harmony, creating an ethereal atmosphere. Technical innovations evident in this work include Vermeer's meticulous use of camera obscura for capturing perspective and light effects, highlighting his interest in optical realism and precision. The painting remains a poignant exploration of introspection, set against the backdrop of the socio-political and religious shifts of the 17th century.","National Gallery of Art, Washington, D.C., USA",woman-holding-a-balance
Johannes Vermeer,The Art of Painting,1666-1668,"Johannes Vermeer, a master of the Dutch Golden Age, created 'The Art of Painting' during one of his most prolific periods, around 1666-1668. This painting is considered one of Vermeer's masterpieces as it exemplifies the intricate play of light, meticulous technique, and profound symbolism characteristic of his work. The nuanced rendering of the textures and surfaces, such as the shimmering chandelier and the artist's tapestry-like cloak, reflect Vermeer's exceptional skill with light and detail. The painting provides a glimpse into art's power to capture history and impart cultural insight, with the depicted map of the Netherlands suggesting the socio-political context of a unified Dutch Republic. Similarly, the subject—a muse representing Clio, the muse of history—underlines the significance of art in documenting historical narratives. 'The Art of Painting' is not only notable for its technical precision but also for its introspective view on the role of the artist and the act of painting itself. This work is pivotal in art history for its sophisticated composition and symbolic depth, establishing Vermeer as a central figure in 17th-century European art.","Kunsthistorisches Museum, Vienna, Austria",the-art-of-painting
Jacques-Louis David,The Death of Marat,1793,"""The Death of Marat"" was painted in 1793 by Jacques-Louis David during the height of the French Revolution, a period marked by extreme political and social upheaval. The painting depicts the assassination of Jean-Paul Marat, a radical journalist and politician who was a fervent supporter of the Revolution. Marat was killed in his bathtub by Charlotte Corday, a Girondin sympathizer opposing his radical Jacobin stance. David was a close friend and political ally of Marat, and he painted this work to serve as both a tribute and a piece of revolutionary propaganda. The composition borrows from religious iconography, reminiscent of the Pietà, infusing Marat's death with martyr-like significance. David’s careful play of light and shadow, stark realism, and use of a limited color palette reflect the emotional intensity and solemnity of the moment. This painting is significant for its role as a politically charged image, embodying the spirit of the Revolution and serving as an early example of the Neoclassical style, which David championed. Neoclassicism was characterized by its focus on moral virtue and clarity, aiming to embody the virtues of classical antiquity. ""The Death of Marat"" is celebrated both for its technical mastery and its layered, poignant narrative, encapsulating a critical moment in history with lasting cultural resonance.","Musées Royaux des Beaux-Arts, Brussels, Belgium",the-death-of-marat
Jacques-Louis David,Oath of the Horatii,1784,"Jacques-Louis David completed 'Oath of the Horatii' in 1784, a pivotal period leading up to the French Revolution. The painting is a quintessential example of Neoclassicism, characterized by clarity, order, and symmetry, and diverged from the Rococo style popular before it. David was inspired by the need to convey moral seriousness and civic virtue, reflecting Enlightenment ideals. Commissioned by King Louis XVI, the painting illustrates a story from Roman legend involving an oath taken by the Horatii brothers to defend Rome, signifying loyalty and patriotism. Its stark lighting, rigorous composition, and emphasis on anatomy are notable technical aspects. 'Oath of the Horatii' was significant in emphasizing stoicism and moral austerity, earning David a position as a major propagator of Neoclassical ideals that aligned with the political climate of pre-revolutionary France. The painting's impact was profound, reflecting the zeitgeist and influencing revolutionary fervor in its emphasis on sacrifice for the greater good.","Louvre Museum, Paris, France",oath-of-the-horatii
Jacques-Louis David,The Coronation of Napoleon,1807,"Jacques-Louis David's 'The Coronation of Napoleon' was completed in 1807 and depicts the grand event of December 2, 1804, in the Notre-Dame Cathedral, where Napoleon Bonaparte crowned himself Emperor of the French. Commissioned by Napoleon himself, the painting was intended to legitimize and glorify his rule, reflecting the grandeur and power of the newly established Empire. David, a leading figure of Neoclassicism, was deeply influenced by the ideals of Classical art, seen in the balanced composition and grandeur of the scene. The painting is notable for its monumental scale, detailed portraiture, and dramatic representation of the event. The emphasis on historical accuracy is evident, though David included artistic liberties such as portraying Napoleon's mother, who was not present at the event. The work stands as a testament to David's skills in portraiture and his ability to convey political propaganda through art. Neoclassicism's emphasis on order and rationality is clearly depicted, aligning with the broader Enlightenment ideals that influenced David's career. 'The Coronation of Napoleon' has become an iconic representation of early 19th-century French art and history, symbolizing both the rise of Napoleon and the political transformation of the era. Its sophisticated composition and execution demonstrate David's mastery and his role in shaping visual culture during the Napoleonic era.","Louvre Museum, Paris, France",the-coronation-of-napoleon
Jacques-Louis David,The Death of Socrates,1787,"Jacques-Louis David's 'The Death of Socrates' was painted in 1787 during a period when Neoclassicism was gaining prominence, reflecting a renewed interest in classical antiquity. Inspired by Plato's dialogues, the painting depicts the moments before Socrates' execution by poison, a result of his supposed corruption of Athenian youth and impiety. Socrates is shown as a stoic martyr, surrounded by grieving disciples, embodying the Enlightenment ideals of reason, virtue, and intellectual sacrifice. David, influenced by the political climate preceding the French Revolution, used this work to critique the corruption and tyranny of contemporary society and to exalt moral fortitude. The painting displays David's mastery of classical techniques, including its linear composition, idealized forms, and dramatic use of chiaroscuro. The precise arrangement of figures and the expressive gestures amplify the emotional drama, while the sober palette and architectural setting evoke the austerity and clarity of ancient Greek art, underscoring the painting's moral message. 'The Death of Socrates' stands as a pivotal work in David's career and in art history, marking a decisive departure from the rococo frivolity of the time towards rigor and clarity, influencing both the aesthetic and intellectual currents in the lead-up to the French Revolution.","The Metropolitan Museum of Art, New York, United States",the-death-of-socrates
Jacques-Louis David,Leonidas at Thermopylae,1814,"Jacques-Louis David's painting 'Leonidas at Thermopylae,' created in 1814, belongs to his mature neoclassical period, reflecting the Enlightenment ideals and the Romantic fascination with heroism. Inspired by historical narratives, David chose the famous Battle of Thermopylae, where King Leonidas and his small Spartan force made a courageous stand against the Persian army. The painting emphasizes themes of sacrifice, valor, and the aesthetic appeal of the male form, aligning with neoclassical erudition and its focus on antiquity as a model for contemporary virtue. David's composition incorporates classical elements, such as idealized anatomy and tranquil backgrounds, showcasing his mastery of line and structure, which decidedly influenced the Romantic movement. This work is significant as it came during the turbulent Napoleonic era when France revered Greek and Roman history as allegories for nationalism. The piece was completed as David navigated his shifting political alliances, just before his exile following the fall of Napoleon. 'Leonidas at Thermopylae' reveals David's continued evolution as a key figure in bridging neoclassical ideals with romantic expression, and epitomizes the tension between noble sacrifice and inevitable defeat, a narrative reflecting the societal and political zeitgeist of post-revolutionary France.","Louvre Museum, Paris, France",leonidas-at-thermopylae
El Greco,The Burial of the Count of Orgaz,1586,"El Greco's 'The Burial of the Count of Orgaz,' painted in 1586, was commissioned for the Church of Santo Tomé in Toledo, Spain. The painting was inspired by a local legend of Don Gonzalo Ruiz, the Count of Orgaz, a 14th-century nobleman renowned for his piety and generosity. According to the story, Saint Stephen and Saint Augustine descended from heaven to assist in his burial to honor his virtuous life. This work is a masterpiece of Mannerism, identifiable by its elongated figures, expressive poses, and intricate use of light. El Greco's distinct color palette and dramatic composition convey a spiritual intensity that reflects both the religious fervor of the Counter-Reformation and his personal vision. The painting is divided into two zones, with the earthly burial scene at the bottom and the heavenly realm above, creating a dynamic spiritual narrative. El Greco's integration of Byzantine influences, visible in the complex arrangement and spiritual focus, is significant in the history of Western art for bridging the gap between Byzantine and Renaissance artistic traditions.","Church of Santo Tomé, Toledo, Spain",the-burial-of-the-count-of-orgaz
El Greco,View of Toledo,1596-1600,"El Greco's 'View of Toledo,' created between 1596 and 1600, stands out as one of the few surviving landscapes by the artist, who was predominantly known for his religious compositions. This work is celebrated for its dramatic portrayal of Toledo, highlighting the vibrant yet foreboding mood typical of the late Spanish Renaissance. During this period, El Greco was exploring Mannerism, characterized by elongated forms and a spiritual expressiveness. The painting is significant for its emotive brushwork and dramatic sky, reflecting El Greco's tendency towards dynamic compositions and a heightened sense of color that presaged the Baroque style. Inspired by the city where he lived and worked, 'View of Toledo' also demonstrates El Greco’s affinity for emotional storytelling through landscapes, a relatively rare focus at the time. Toledo, as the center of religious scholarship and power, represents both spiritual and earthly domains, a duality captured in the painting's turbulent sky and serene ground. This painting has influenced numerous artists and is regarded as a precursor to Romanticism, reflecting an internalized view of the landscape rather than an objective representation.","The Metropolitan Museum of Art, New York, USA",view-of-toledo
El Greco,The Disrobing of Christ,1577-1579,"El Greco’s 'The Disrobing of Christ,' created between 1577 and 1579, marked his initial commission in Toledo, Spain, for the Cathedral of Toledo's sacristy. This work reflects his transition from the Byzantine traditions of Crete to the Italian Renaissance influences he encountered in Venice and Rome, combined with the intense spirituality of the Counter-Reformation in Spain. The painting captures Christ being stripped of His garments before the Crucifixion, situated in a vertical, opposing force composition that accentuates the tension and chaos around Him. El Greco’s unique color palette, dramatic Use of light and shade, and elongated figures are distinct in this work, foreshadowing Mannerism's stylized forms and emphasizing spiritual transcendence and psychological drama over physical realism. This painting is significant as it solidified El Greco’s reputation in Spain, illustrating his mastery in combining religious intensity with a powerful, expressive artistic style. It also reflects the blending of different cultural and artistic influences of 16th-century Europe and highlights the artist’s devout religious faith and innovative approach, which influenced Spanish art significantly.","Sacristy of the Cathedral, Toledo, Spain",the-disrobing-of-christ
El Greco,Laocoön,1610-1614,"El Greco's 'Laocoön' is one of his final works, painted between 1610 and 1614 during the latter part of his life in Toledo, Spain. The painting tackles the classical myth of Laocoön, the Trojan priest, who, along with his sons, was punished by the gods with deadly serpents for attempting to reveal the Greeks' ruse of the wooden horse. In diverging from the classical narratives often depicted in well-known sculptures, El Greco placed the scene in a contemporary landscape of Toledo rather than ancient Troy, imbuing it with a personal interpretation. The work is significant for its dramatic use of elongated figures, swirling compositions, and a vivid color palette, characteristic of El Greco's mature style. This expressionistic handling and the ethereal, almost otherworldly light resonate with the artist's distinctive approach, which influenced later Expressionist painters. The painting reflects the tumultuous period in Spain, marked by religious upheaval and the Counter-Reformation, elements subtly mirrored in its emotional intensity and dramatic tension. 'Laocoön' stands not only as a milestone within El Greco’s oeuvre but also as a testament to a transitional phase in art history, where mannerism began giving way to the Baroque.","National Gallery of Art, Washington, D.C., USA",laocoon
El Greco,Saint John the Baptist,circa 1600,"El Greco's 'Saint John the Baptist' was created during the height of the Spanish Renaissance, a period marked by religious fervor and artistic experimentation. Mannerism, an art style known for its elongated figures and emotive expressiveness, heavily influenced El Greco's work. This painting showcases these characteristics, with the elongated form of John, dramatic use of colors, and a mystical atmosphere. It reflects El Greco's Greek origins combined with his profound adaptation in Spain, incorporating Byzantine and Venetian influences into his work. The painting captures the religious intensity of the Counter-Reformation, focusing on spiritual emotionalism rather than classical restraint. El Greco is known for conveying deep spiritual and emotional narratives through complex compositions and vivid color palettes, contributing significantly to the transition to Baroque art. This work is significant for its bold stylistic departure from Renaissance balance and symmetry, paving the way for future artists to explore more expressive and abstract forms.","Legion of Honor Museum, San Francisco, USA",saint-john-the-baptist
John Constable,The Hay Wain,1821,"John Constable's 'The Hay Wain,' painted in 1821, is one of the masterpieces of the Romantic period in art, embodying an idyllic vision of rural England. This painting is closely tied to Constable's lifelong quest to render landscapes with emotive power, inspired by his profound connection to his birthplace in Suffolk, England. The work depicts a scene near Flatford Mill on the River Stour, showing a man leading a hay wain—a type of horse-drawn cart—across the stream. Constable's innovative use of natural light and weather in the painting is remarkable, capturing the transient effects of the environment and emphasizing a dynamic, atmospheric realism that was revolutionary at the time. This piece played a crucial role in the nascent Romantic movement, showcasing an emotional engagement with nature that contrasted sharply with the industrial changes sweeping England. Though initially unappreciated in his home country, Constable found success in France, influencing the Barbizon School and later, the Impressionists. 'The Hay Wain' remains significant in art history for its technical innovation and as an evocation of a pastoral England that was rapidly disappearing.","The National Gallery, London, United Kingdom",the-hay-wain
John Constable,Dedham Vale,1828,"John Constable, a key figure in the Romantic movement, painted Dedham Vale in 1828. This work is a quintessential example of Constable's dedication to capturing the natural beauty of the English countryside, particularly the region around his birthplace that he referred to as 'Constable Country.' Inspired by his deep attachment to his native landscape, 'Dedham Vale' exemplifies his revolutionary approach to capturing the interplay of light and atmosphere. Constable's use of loose brushwork and soft colors reflects the changing moods of the natural environment, and his application of paint in a manner that suggests natural texture and movement was innovative at the time. The painting's emphasis on ordinary, rural scenes challenged the prevailing preference for grand historical and mythological subjects. Constable's focus on atmospheric effects and dynamic skies influenced subsequent generations of artists, including the French Impressionists. He believed that rural landscapes could evoke significant emotional responses and spiritual reflections, thus contributing to the Romantic ideal of nature's sublime beauty. 'Dedham Vale' was created during a period of increasing industrialization in England, offering a visual respite from urban expansion and symbolizing a nostalgic longing for an idyllic, pastoral past.","Victoria and Albert Museum, London, UK",dedham-vale
John Constable,The Cornfield,1826,"The Cornfield, painted by John Constable in 1826, embodies the artist's deep affection for the English countryside and his innovative approach to landscape painting during the Romantic period. Constable, known for his dedication to capturing natural scenes, was inspired by the Suffolk landscapes of his youth, and this painting reflects his personal connection to the area around his native East Bergholt. The Cornfield exemplifies Constable's pioneering technique of using natural light and atmosphere, marking a shift from the idealized landscapes of his predecessors to a more realistic and emotionally resonant portrayal of nature. This painting, depicting a bright summer's day with children and cattle, showcases the use of vigorous brushstrokes and the inclusion of detailed sky study, both of which highlight Constable's commitment to depicting the changing effects of light and weather. It holds significant art historical importance as it influenced the development of the Barbizon School and later the Impressionists, who admired Constable's plein air practice and use of color. The work reflects the broader Romantic era's valuation of emotion and nature and remains a quintessential example of Constable's influence in moving landscape painting towards modernism.","National Gallery, London, England",the-cornfield
John Constable,Salisbury Cathedral from the Meadows,1831,"Salisbury Cathedral from the Meadows, painted by John Constable in 1831, is a masterpiece of the Romantic period characterized by its deep emotionalism and dramatic depiction of natural landscapes. The painting is one of Constable's six-foot masterpieces, large-scale works intended to capture the sublime power of nature. Constable was inspired by his deep attachment to the English countryside, and Salisbury Cathedral held personal meaning due to his friendship with Archdeacon John Fisher, who lived near the cathedral. This painting features dramatic skies and a rainbow symbolizing hope after a storm, elements that showcase Constable's signature blending of meticulous detail with expressive brushwork. The work exemplifies Constable's inventive use of broken brushstrokes and light effects that capture the transient moods of the English climate. Its historical significance lies in its influence on the development of the Barbizon School in France and, subsequently, the Impressionist movement. Through this painting, Constable expressed both a technical mastery in depicting natural light and a keen emotional connection to his subject.","The painting is part of the Paul Mellon Collection at the National Gallery, London, United Kingdom.",salisbury-cathedral-from-the-meadows
John Constable,Wivenhoe Park,1816,"'Wivenhoe Park' by John Constable, painted in 1816, is an exemplary piece of the English Romantic movement, highlighting the artist's commitment to naturalistic landscape painting. Constable was commissioned to paint this estate by Major General Francis Slater-Rebow, offering him the opportunity to depict the tranquil English countryside with meticulous realism and sensitivity to atmospheric conditions, characteristics that became hallmarks of Constable’s work. The painting reflects the growing Romantic fascination with the representation of nature, the pastoral, and the sublime, counteracting the prevailing neoclassical emphasis on historical and mythological subjects. Constable’s innovative technique of using bright, fresh colors and loose brushwork to capture the play of light and the changing sky marked a departure from the more ordered landscapes of previous artists, paving the way for future developments in landscape art, including the Impressionist movement. Set against the historical backdrop of early 19th-century Europe, a period rife with industrial transformation, Constable's work signaled a nostalgic and reverent view of rural life, resonating with contemporary audiences caught in the flux of rapid change.","National Gallery of Art, Washington, D.C., USA",wivenhoe-park
