artist_name,painting_name,year,context,location,slug
Max Beckmann,The Night,1918-1919,"Max Beckmann's painting ""The Night"" was created between 1918 and 1919, during a volatile period marked by the aftermath of World War I and the German Revolution. The chaos and trauma of this era deeply influenced Beckmann's work, prompting a shift from his earlier Impressionist style to a new, harsher expression. ""The Night"" is emblematic of Beckmann's transition into New Objectivity, an art movement characterized by its realistic depiction of the disillusionment following the war. The painting is a grim narrative of violence and existential dread, capturing a violent home invasion scene that has been interpreted as a metaphor for the chaos of the contemporary world. Technically, Beckmann employs a distorted, angular style, using sharp, jarring lines and murky color palettes to heighten the emotional tension and intensity of the subject matter. The painting serves as a powerful commentary on human brutality, societal breakdown, and personal suffering, reflecting a broader cultural disorientation of post-war Germany. It stands as a significant work in Beckmann's career and a pivotal piece within the Neue Sachlichkeit (New Objectivity) movement, encapsulating the raw and unsettling reality of the time.","Kunstsammlung Nordrhein-Westfalen, Düsseldorf, Germany",the-night
Max Beckmann,Departure,1932-1933,"'Departure,' a triptych by Max Beckmann, was created during an era of intense political turmoil in Germany. Beckmann, often associated with the New Objectivity movement, managed to encapsulate the disillusionment and chaos prevalent in the Weimar Republic leading up to the Nazi regime. This painting reflects his complex response to the political oppression and personal experiences of exile. It symbolizes escape and liberation, with the central panel depicting a serene and regal figure with a child, interpreted as hope. In contrast, the side panels portray brutality and entrapment. The technical mastery lies in Beckmann's use of bold lines, vivid colors, and symbolic imagery, drawing on both German Expressionism's emotional intensity and Classical traditions. Stylistically, it marks Beckmann's departure from pure expressionism to a more structured and allegorical form, containing layers of personal and political meanings. This work holds a significant place in art history as a testament to the transformative power of art amidst oppression, as well as Beckmann's resilience and creativity in confronting his era's horrors.","Museum of Modern Art, New York, USA",departure
Max Beckmann,Bird's Hell,1938,"Max Beckmann's 'Bird's Hell' was painted in 1938, during his exile years spurred by the oppressive regime of Nazi Germany. Beckmann, barred from exhibiting his work in Germany due to the Nazi's 'Degenerate Art' campaign, delved deeply into themes of political and personal turmoil in his art. 'Bird's Hell' is embedded with symbols of tyranny, brutality, and the grotesque, articulated through Beckmann's sharp, angular lines and vivid palette. The painting employs elements of expressionism and is noted for its complex composition, weaving a narrative of psychological and societal chaos. Beckmann moved to Amsterdam in 1937, where he, amidst the backdrop of impending war across Europe, created this vivid tableau that criticizes authoritarian regimes and human cruelty. Its audacious, distorted figures and hellish landscape echo the anxieties and foreboding of pre-World War II Europe. 'Bird's Hell' stands as one of Beckmann's most significant anti-war statements, reflecting both personal conflict and broader sociopolitical commentary, marking a crucial moment in the expressionist critique of contemporary society.","Neue Galerie, New York, USA",bird-s-hell
Max Beckmann,Christ and the Woman Taken in Adultery,1917,"Max Beckmann's 'Christ and the Woman Taken in Adultery' was completed in 1917, during a period of profound personal and societal upheaval. Beckmann, a German painter, was deeply affected by his experiences during World War I, both as a soldier and as a witness to its horrors, which led him to abandon earlier expressionism in favor of a new objectivity. This painting reflects his shift towards a more introspective and symbolic exploration of themes. The work depicts the biblical story of Christ and the woman accused of adultery, a narrative that Beckmann uses to explore themes of judgment, morality, and redemption. His use of sharp lines, distorted forms, and a somber palette reflects the chaotic post-war atmosphere and Beckmann's psychological tension. Its composition, with Christ positioned as a dignified figure amidst a crowd of exaggerated, almost grotesque characters, highlights the conflict between human frailty and divine compassion. The painting is significant as it marks Beckmann's transition into his mature style, characterized by its dramatic, narrative-driven content, and it paved the way for his later monumental triptychs. It remains a powerful commentary on human suffering and spiritual resilience amidst social collapse.","Saint Louis Art Museum, Saint Louis, Missouri, USA",christ-and-the-woman-taken-in-adultery
Max Beckmann,The Argonauts,1949-1950,"Max Beckmann's 'The Argonauts' was completed in 1949-1950 during a period marked by post-World War II reflections and existential inquiry. As a German painter and printmaker, Beckmann was an important figure in the New Objectivity movement, and his works often explored themes of existential unrest and human suffering. 'The Argonauts,' one of his final triptychs, can be seen as a culmination of Beckmann's lifelong interest in mythological themes, in this case drawing inspiration from the Greek myth of Jason and the Argonauts. The painting can be interpreted as a metaphorical journey, representing the artist's quest for meaning and understanding in the turbulent 20th century. Beckmann was known for his complex compositions and use of bold lines and colors, which are evident in this piece. Through its three-panel structure, the triptych invites viewers to contemplate each section's narrative independently, while contributing to an overarching philosophical dialogue. The work, rich in symbolic details, highlights Beckmann's skillful integration of personal experiences and broader mythological references, embodying the artist's distinctive style during his later years spent in the United States.","Saint Louis Art Museum, St. Louis, Missouri, USA",the-argonauts
Pierre-Auguste Renoir,Luncheon of the Boating Party,1880-1881,"Luncheon of the Boating Party was painted by Pierre-Auguste Renoir from 1880 to 1881, during the height of the Impressionist movement, which emphasized capturing the effects of light and atmosphere with loose, rapid brushstrokes. Renoir, inspired by the vibrant sociability of Parisian life and contemporaries like Édouard Manet, created this masterpiece at the Maison Fournaise restaurant along the Seine River, a popular leisure spot for Parisians.

The painting depicts a lively scene of friends enjoying a meal, featuring figures well-known in Renoir's circle, such as fellow artists and critics. This personal connection adds intimacy and authenticity, making it a quintessential Impressionist work reflecting the era's cultural ethos—an embrace of modernity, conviviality, and leisure.

Renoir's innovative use of soft light and color harmony captures the atmosphere of a sun-drenched terrace. Unlike his contemporaries, he combined rich figural representation with the Impressionist focus on light. Notably, the work illustrates Renoir's transition towards a more solid and structured approach that foreshadowed his later work.

Culturally, the painting epitomizes 'La Vie Moderne'—a celebration of contemporary Parisian life, simultaneously a snapshot of leisure and a manifesto celebrating Impressionist ideals. Its inclusion in the Seventh Impressionist Exhibition in 1882 helped bolster Renoir's reputation as a master of creating vibrant, expressive scenes.","The Phillips Collection, Washington, D.C., USA",luncheon-of-the-boating-party
Pierre-Auguste Renoir,Dance at Le Moulin de la Galette,1876,"Dance at Le Moulin de la Galette, created in 1876 by Pierre-Auguste Renoir, epitomizes the vibrancy and spontaneity of the Impressionist movement. Painted during the height of Impressionism, this artwork captures a lively Sunday afternoon at Le Moulin de la Galette in the Montmartre district of Paris, a popular venue frequented by Parisians for social gatherings and dances. Characterized by loose brushwork and a bright palette, the painting reflects Renoir's interest in capturing movement, light, and the joy of modern urban life. The artist deftly employs light to create a dynamic atmosphere where sunlight filters through trees, casting soft shadows on the crowd. Renoir's innovative use of dappled light and color create a sense of immediacy and liveliness, aligning with the Impressionist goal of depicting the fleeting nature of modern life. The painting is significant in art history as it breaks from academic tradition, embracing a more naturalistic and emotive approach. Its depiction of ordinary Parisians enjoying leisure time speaks to social changes during the late 19th century, highlighting shifts toward modernity and urbanization. Dance at Le Moulin de la Galette remains a landmark work that exemplifies Renoir's mastery in capturing the human form and communal joy.","Musée d'Orsay, Paris, France",dance-at-le-moulin-de-la-galette
Pierre-Auguste Renoir,The Swing,1876,"""The Swing,"" or ""La Balançoire,"" was painted by Pierre-Auguste Renoir in 1876, a period when the Impressionist movement was at its peak. This painting was created during a time when artists sought to capture the effects of light and movement in outdoor settings, often focusing on modern bourgeois leisure activities. Renoir's ""The Swing"" is emblematic of this approach, portraying a playful and idyllic scene of a young woman on a swing surrounded by figures engaging in conversation at a garden party. The subtle interplay of light and shadow across their faces and clothing highlights Renoir's skill in depicting the ephemeral conditions of light. The choice of setting and subject matter reflects the social changes of late 19th-century France, where urban parks and leisure activities became popular among the middle class. Technical innovations include the use of loose, quick brushstrokes to convey movement and atmosphere, a hallmark of Impressionism. ""The Swing"" contributed to the broader acceptance of Impressionist techniques and themes, and Renoir's handling of the interplay of light remains highly regarded. This work, first exhibited at the third Impressionist exhibition in 1877, helped to solidify Renoir's reputation as a leading figure in the movement.","Musée d'Orsay, Paris, France",the-swing
Pierre-Auguste Renoir,Two Sisters (On the Terrace),1881,"""Two Sisters (On the Terrace),"" painted in 1881 by Pierre-Auguste Renoir, is a celebrated example of the artist's Impressionist style. Created during Renoir's mature period, the painting depicts a tranquil scene along the Seine River at the Maison Fournaise, a popular leisure spot outside Paris. Renoir was known for capturing the effects of light and color, and in this work, he imbues the scene with vibrant hues and soft brushwork that characterize Impressionism. The painting showcases two figures—representing innocence and beauty—against a lush, sunlit backdrop. Renoir’s use of luminous color and lively brushwork reflects his interest in depicting modern, leisurely life. The painting is significant for its portrayal of contemporary social dynamics and its contribution to the Impressionist movement, characterized by an emphasis on capturing fleeting moments and the play of natural light. Renoir’s artistic exploration in this period also demonstrates a shift towards depictions of everyday life, contributing to the broader socio-cultural narrative of Industrial Age Parisian society.","Art Institute of Chicago, Chicago, USA",two-sisters-on-the-terrace
Pierre-Auguste Renoir,Young Girls at the Piano,1892,"'Young Girls at the Piano' was painted by Pierre-Auguste Renoir in 1892. Renoir, one of the leading figures of the Impressionist movement, was transitioning towards a softer, more classical style during this period, often referred to as his 'Ingres period.' Known for its harmonious composition and warm palette, the painting exemplifies Renoir's mature style, which combined the impressionist focus on light and color with a more structured approach. The scene captures an intimate domestic moment, depicting two young girls at a piano—a subject reflecting Renoir's interest in capturing the joys of contemporary bourgeois life. This painting aligns with the Impressionist ethos of portraying everyday scenes with immediacy and warmth, yet Renoir's handling of the subject shows influences from both Impressionism and the more traditional academic style, focusing on smooth contours and delicate coloring. The work was commissioned by the French government and highlights Renoir's esteemed position in the art world at the time. It stands as a testament to the artist's ability to capture both the innocence and vibrancy of youth.","Musée d'Orsay, Paris, France",young-girls-at-the-piano
Berthe Morisot,The Cradle,1872,"Berthe Morisot's ""The Cradle"" was painted in 1872, during the early years of the Impressionist movement, which emerged in France as a reaction against the rigid conventions of the academic art world of the time. This painting marks a significant moment in Morisot's career and within Impressionism, as she was the first woman to exhibit with the Impressionists in 1874. The painting depicts Morisot's sister, Edma, watching over her sleeping daughter, portrayed with tender intimacy and soft brushwork that characterize Morisot's style. The intimate domestic scene reflects the Impressionists' focus on capturing contemporary life, employing light, and brushstroke techniques to convey the ephemeral nature of vision. The choice of a family subject also underscores the unique perspective Morisot brought to the movement, emphasizing women’s private world. ""The Cradle"" illustrates her innovative use of light and loose brushwork, aligning with Impressionism's goals while subtly challenging the traditional male-dominated narrative of what constituted suitable subjects for serious art. This work is historically significant as an early example of female-led exploration within Impressionism, revealing the nuanced role gender played in the representation of domestic life and maternal bonds.","Musée d'Orsay, Paris, France",the-cradle
Berthe Morisot,Woman at Her Toilette,1875,"""Woman at Her Toilette"" by Berthe Morisot, painted in 1875, exemplifies Impressionism's focus on modern life and the intimate, everyday moments of the bourgeoisie. As one of the leading female figures in the male-dominated Impressionist movement, Morisot brought a unique perspective, often depicting women in domestic settings. The painting captures a woman thoughtfully engaged in her toilette, a common theme illustrating women's private and unguarded moments. Morisot's brushwork is loose and fluid, embodying the Impressionist emphasis on capturing fleeting moments and the effects of light. The interplay of soft colors and delicate strokes helps evoke a sense of immediacy and intimacy. Her work, often undervalued compared to her male peers, is now celebrated for its subtle exploration of femininity and domesticity. This painting reflects the 19th-century context of changing gender roles and the rise of modern urban life. Its artistic significance lies in both Morisot's ability to convey emotion through technique and her contribution to advancing women's presence in art.","Art Institute of Chicago, Chicago, USA",woman-at-her-toilette
Berthe Morisot,Summer's Day,1879,"""Summer's Day"", painted in 1879 by Berthe Morisot, is a quintessential example of Impressionist art, a movement characterized by its focus on capturing the transient effects of light and color. Morisot, one of the prominent women in the Impressionist circle, often depicted intimate, domestic scenes and landscapes from a female perspective. This painting features two women in a boat on a serene lake, capturing a fleeting moment of leisure and tranquility. The loose brushwork and light palette highlight Morisot's ability to convey atmosphere and emotion through her unique, delicate touch. In creating ""Summer's Day,"" Morisot was influenced by her contemporaries, including Édouard Manet, with whom she shared a close friendship. The painting represents a subtle break from traditional academic painting, illustrating the Impressionists' emphasis on everyday scenes and the interplay of light. ""Summer's Day"" holds a significant place in art history due to its demonstration of Morisot's artistry within a male-dominated movement, highlighting the evolving roles of women in both art and society during the late 19th century. The setting, Bois de Boulogne in Paris, was a popular leisure spot, reflecting the growing leisure culture of the time.","National Gallery, London, United Kingdom",summer-s-day
Berthe Morisot,The Artist's Sister at a Window,1869,"Created in 1869, 'The Artist's Sister at a Window' by Berthe Morisot exemplifies the Impressionist movement's core characteristics, including the emphasis on light and everyday scenes. The painting features Morisot's sister, Edma Pontillon, captured in a private, introspective moment, which speaks to the intimate and personal nature of Morisot's work. During this period, Morisot was part of the pioneering group of Impressionists that included figures like Claude Monet and Édouard Manet (her brother-in-law through marriage). Influenced by the loose, expressive brushwork typical of Impressionism, Morisot's technique involved nuanced applications of color and light, which lent her portraits a soft, ethereal quality. The cultural context of this work is deeply rooted in the rapidly changing social and artistic landscape of late 19th century France, as industrialization and modernity began to transform daily life and public spaces. Despite societal barriers facing female artists at the time, Morisot broke through constraints by presenting domestic and internal worlds with a fresh, evocative perspective. This painting not only showcases Morisot's technical innovations in terms of composition and light manipulation but also marks an important contribution to the evolution of women in the art world, highlighting her role in legitimizing female perspectives during a predominantly male-oriented era.","Musée Marmottan Monet, Paris, France",the-artist-s-sister-at-a-window
Berthe Morisot,View of Paris from the Trocadero,1871-1872,"Berthe Morisot, an illustrious figure in the Impressionist movement, painted 'View of Paris from the Trocadero' around 1871–1872, a period critical in shaping modernist art. This piece was created shortly after the Franco-Prussian War, during the rebuilding of Paris both physically and culturally in the aftermath of conflict. The painting captures the landscapes as seen from the Trocadero, utilizing Morisot's signature loose brushwork and light palette that encapsulate the essence of Impressionism. Her choice of perspective not only captures a dynamic urban landscape but also highlights Morisot's innovative approach to composition, focusing on the transitory effects of light and atmosphere, a hallmark of Impressionist aesthetics. By depicting everyday scenes and ordinary vistas of her environment with such intimacy and freshness, Morisot's work contributed to redefining the role of women artists in the late 19th century, asserting their presence in a dominantly male art world. This painting is emblematic of her capacity to portray the subtleties of urban life, thus marking a significant historical context within art history where personal impression and modernity merged.","Musée Marmottan Monet, Paris, France",view-of-paris-from-the-trocadero
Gustave Caillebotte,"Paris Street, Rainy Day",1877,"Gustave Caillebotte's 'Paris Street, Rainy Day,' painted in 1877, captures a quintessential moment of modern urban life in late 19th-century Paris. This period was marked by significant urban renovations led by Baron Haussmann, which transformed Paris into the city of wide boulevards and grand architecture that we recognize today. Caillebotte was deeply influenced by these urban changes and sought to represent modernity through his work. The painting is significant within the context of Impressionism, though Caillebotte's style is characterized by a unique combination of realistic detail and impressionistic techniques, such as his careful attention to perspective and the depiction of light reflecting off wet surfaces—a novel technique for the time. His use of cropped figures and a focus on the play of light and shadow demonstrates an influence from photography, which was gaining popularity. 'Paris Street, Rainy Day' is also a testament to Caillebotte's interest in perspective and spatial organization, with its focus on daily life infused with a sense of depth and three-dimensionality. This work contributes to the Impressionist movement by portraying the fleeting effects of weather and light, as well as capturing the essence of contemporary bourgeois society during a transformative era in Paris.","Art Institute of Chicago, Chicago, United States",paris-street-rainy-day
Gustave Caillebotte,The Floor Scrapers,1875,"Painted in 1875, 'The Floor Scrapers' is one of Gustave Caillebotte's early masterpieces and a quintessential work of the Realist movement. Caillebotte, known for his precise draftsmanship and unique perspectives, was inspired by the everyday life of Parisian workers. This painting depicts laborers refinishing the floor of a Paris apartment, bringing attention to the beauty and dignity of manual labor, which was an uncommon subject matter in high art at the time. The work is significant as it defies traditional depictions by aligning the viewer's perspective with that of the workers rather than the bourgeoisie. Caillebotte's use of natural light, detailed textures, and compositional structure reveal the influence of Impressionism while maintaining a distinct Realist sensibility. The painting exhibits a striking combination of depth, as realized through precise linear perspective, and the vibrant play of light, showcasing Caillebotte’s innovative approach in bridging Realism and Impressionism. Caillebotte's socio-political insight and technical proficiency mark 'The Floor Scrapers' as a pivotal work in late 19th-century art, challenging bourgeois art norms and highlighting the convergence of everyday life and aesthetic beauty.","Musée d'Orsay, Paris, France",the-floor-scrapers
Gustave Caillebotte,The Pont de l'Europe,1876,"Gustave Caillebotte's 'The Pont de l'Europe,' painted in 1876, captures the dynamic urban life of late 19th-century Paris, a city in the midst of transformation under Baron Haussmann's renovations. Caillebotte, a lesser-known but significant figure in the Impressionist movement, was inspired by the new cityscapes emerging as his city underwent rapid modernization. The painting is characterized by its perspective and composition that demonstrate Caillebotte's interest in contemporary life, as well as his technical prowess and eye for realism. Caillebotte’s approach was more structured and precision-focused compared to his contemporaries such as Monet and Renoir, evident in the sharp angles and the meticulous rendering of the iron bridge. 'The Pont de l'Europe' reflects the optimism and forward-looking spirit of the era and provides commentary on industrialization's impact on everyday life, blending traditional artistic techniques with modern subject matter. Its representation of figures from different social classes highlights the socio-economic diversity inherent in urban settings like Paris, making it notable for both its aesthetic appeal and social commentary.","Musée du Petit Palais, Geneva, Switzerland",the-pont-de-l-europe
Gustave Caillebotte,Le Pont de l'Europe (Study),1876,"Gustave Caillebotte, a French Impressionist painter, created ""Le Pont de l'Europe (Study)"" in 1876 during a transformative period in both Paris and the art world. This period followed Baron Haussmann's extensive renovations of Paris, which modernized the city with new boulevards, public spaces, and railway systems, including the bridge depicted in this painting. Caillebotte, known for his keen sense of perspective and dynamic compositions, focused on urban themes, which set him apart from his peers. The painting captures the intricate latticework of the Pont de l'Europe, an engineering marvel of the time, enveloped in the bustling urban life and the airy light that characterizes Impressionism. Caillebotte's use of precise linear perspective and detailed depiction of modern life was innovative and marked a convergence of academic and Impressionist styles. This study reflects his interest in how individuals interact with the rapidly industrializing world, addressing themes of modernity, alienation, and the transient moments of everyday life. ""Le Pont de l'Europe"" is significant in art history for its urban Impressionism and contributes to understanding how artists of that era responded to the ever-changing city environment.","Rhode Island School of Design Museum, Providence, USA",le-pont-de-l-europe-study
