artist_name,painting_name,year,context,location,slug
Élisabeth Vigée Le Brun,Marie Antoinette with a Rose,1783,"'Marie Antoinette with a Rose,' painted by Élisabeth Vigée Le Brun in 1783, represents a pivotal moment both in the artist's career and in the turbulent life of the French monarchy. Vigée Le Brun was a prominent portrait artist favored by the French court for her elegant and flattering depictions. This painting was commissioned to rehabilitate the image of Marie Antoinette, who faced widespread public criticism. The queen is depicted in a simple muslin dress and holding a rose, which symbolizes grace and femininity. The informal yet dignified pose was intended to present Antoinette as a more relatable and modest monarch to the French populace. This work is an example of the Rococo style's transition into Neoclassicism, as seen in its softer color palette and focus on naturalism. The painting reflects the historical context of a monarchy attempting to maintain its image amidst political unrest and captures the dual essence of royal glamour and personal vulnerability in the lead-up to the French Revolution, which unfolded only a few years later in 1789.","Currently housed in the Palace of Versailles, Versailles, France.",marie-antoinette-with-a-rose
Élisabeth Vigée Le Brun,Self-Portrait in a Straw Hat,1782,"Élisabeth Vigée Le Brun's ""Self-Portrait in a Straw Hat"" was painted in 1782, inspired in part by Peter Paul Rubens' ""Le Chapeau de Paille."" This portrait signified a turning point in Vigée Le Brun’s career, reinforcing her status as one of the leading portraitists of her time. At a period when female artists faced significant obstacles, Vigée Le Brun's confident self-presentation, wearing informal attire and with a direct, engaging gaze, broke conventions of female portraiture. Her adept use of light and color captured the essence of Rococo grace and contributed to the burgeoning Neoclassical style. The straw hat itself became a symbol of natural simplicity, contrasting with the opulence of the French aristocracy she often portrayed. Executed during pre-Revolutionary France, the painting also marks an era of Enlightenment ideals where self-expression began to transcend rigid social hierarchies.","The National Gallery, London, United Kingdom.",self-portrait-in-a-straw-hat
Élisabeth Vigée Le Brun,Marie Antoinette and Her Children,1787,"""Marie Antoinette and Her Children"" was painted in 1787 by Élisabeth Vigée Le Brun, one of the few women admitted to the Académie Royale de Peinture et de Sculpture. Commissioned by Louis XVI, this portrait was intended to repair the negative public image of Marie Antoinette by portraying her as a devoted mother, at a time when public sentiment against the monarchy was growing, leading up to the French Revolution. The piece reflects the Rococo style's transition towards a Neoclassical emphasis on realism and moral virtue. Vigée Le Brun's composition shows Marie Antoinette with her children in an affectionate, informal setting, highlighted by the empty cradle symbolizing her recently deceased infant. This emotional undertone was novel and aimed to humanize a queen perceived as frivolous. The painting's stylistic elements, like its soft color palette and dynamic composition, demonstrate Vigée Le Brun's technical mastery. Its historical significance lies in its role as royal propaganda attempting to mitigate the queen's unpopular persona amid the socio-political upheaval of 18th century France.","The Palace of Versailles, Versailles, France",marie-antoinette-and-her-children
Élisabeth Vigée Le Brun,The Duchesse de Polignac,1783,"Élisabeth Vigée Le Brun painted 'The Duchesse de Polignac' in 1783, a period marked by the opulence of the French aristocracy prior to the Revolution. The portrait depicts Yolande Martine Gabrielle de Polastron, a close confidante of Queen Marie Antoinette, highlighting her through the artist’s refined style and delicate brushwork. As a woman artist in the 18th century, Vigée Le Brun gained prominence primarily through her association with the royal court, becoming favored by the queen herself. Her ability to capture both the inner spirit and external grace of her subjects is evident in this piece, marked by a harmonious composition and luminous palette, techniques that contributed to her acclaim in portraiture. This painting exemplifies Rococo elegance with its feminine brushwork and nuanced use of light, hallmarks of Vigée Le Brun’s interpretation of aristocratic beauty. Completed on the eve of the French Revolution, it reflects not only personal relationships within the court but also the broader socio-political environment of France, capturing the fleeting world of the Ancien Régime on the brink of profound change.","Palace of Versailles, Versailles, France",the-duchesse-de-polignac
Élisabeth Vigée Le Brun,Peace Bringing Back Abundance,1780,"Élisabeth Vigée Le Brun's 'Peace Bringing Back Abundance,' painted in 1780, reflects a moment when Neoclassicism was taking root amid the political and cultural upheavals preceding the French Revolution. As a renowned female artist gaining patronage from the French court, Le Brun often depicted themes harmonious with Enlightenment ideals, such as peace and prosperity, resonant in this allegorical work. The painting likely served not only as an artistic expression but also as a political statement promoting peace and the ensuing benefits. Le Brun, celebrated for her portraits of European aristocracy, imbued her works with elegance and a keen eye for detail, reflected in her use of vibrant colors and dynamic composition. Despite societal restrictions on women, her career flourished under royal patronage, particularly from Marie Antoinette. This painting exemplifies her ability to integrate classical themes with contemporary stylistic finesse, contributing to her status as one of the eminent portraitists of her era. Her technique included soft brushwork and harmonious color palettes, aiming to convey light and delicate charm. The artwork's enduring appeal highlights Le Brun's technical prowess and narrative skill, ensuring her prominent place in art history.","Palace of Versailles, Versailles, France",peace-bringing-back-abundance
Tracey Emin,My Bed,1998,"""My Bed"" is an iconic work created by Tracey Emin in 1998, which became a landmark piece in the Young British Artists (YBA) movement. The work is a confessional installation representing Emin's own unmade bed surrounded by personal items such as cigarettes, vodka bottles, stained sheets, and underwear. It was inspired by a depressive phase in the artist's life, reflecting her emotionally tumultuous experiences. The work provocatively blurs the line between art and everyday life, challenging traditional notions of art's subject matter. It drew attention for its raw, autobiographical content and for exemplifying a postmodern approach to art. ""My Bed"" confronts themes of vulnerability, intimacy, and self-exposure, resonating with both art critics and the public. This piece was shortlisted for the Turner Prize in 1999, sparking debates about what constituted art. Emin's work is significant as it opened new dialogues about the role of the artist's lived experience in their creations, influencing subsequent generations of artists exploring personal narratives and identity.","Tate, London, UK",my-bed
Tracey Emin,Everyone I Have Ever Slept With 1963–1995,1995,"'Everyone I Have Ever Slept With 1963-1995' is a seminal work by British artist Tracey Emin, created in 1995. The piece is emblematic of the Young British Artists (YBAs) movement, which emerged in the late 1980s and 1990s, characterized by provocative, personal, and often controversial art. It took the form of a tent appliquéd with the names of all those the artist had slept with—both sexually and non-sexually—spanning three decades. Through this work, Emin explored themes of intimacy, memory, and identity, breaking taboos around female sexuality and confessional art. Its emotional transparency and raw authenticity marked a significant departure from traditional art forms, blurring the lines between public and private life. Emin was inspired by her experiences and relationships, challenging societal norms and inviting viewers to reflect on their perceptions of love and connection. Regrettably, the original work was destroyed in the 2004 Momart warehouse fire. Nevertheless, it remains a pivotal piece that significantly influenced contemporary art practices, cementing Emin's reputation as a leading figure in conceptual and installation art.",The original artwork was destroyed in a warehouse fire in 2004; it is no longer on display.,everyone-i-have-ever-slept-with-1963-1995
Tracey Emin,The Last Thing I Said To You Is Don't Leave Me Here,2010,"Tracey Emin's paintings often dwell on personal themes, exploring emotions such as love, loss, and longing. Created in 2010, ""The Last Thing I Said To You Is Don't Leave Me Here"" embodies Emin's characteristic melding of personal narrative with expressive craftsmanship. This painting arises from a series where Emin expands her artistic practice from predominantly text-based works and installations to more traditional forms such as painting and drawing, thus signaling a pivotal shift in her oeuvre. Her impulsive brushstrokes and use of intense colors illustrate a raw emotionality that aligns with the confessional nature of her artistic expression. The period marks a maturation in Emin’s work where she transitions into exploring more abstract representations of her emotional landscape, against the backdrop of her earlier association with the Young British Artists movement of the 1990s. Culturally, her work reflects a broader trend of the 21st century towards introspective art, where individual experience is foregrounded in response to an increasingly complex societal context.","The Museum of Modern Art (MoMA), New York, USA",the-last-thing-i-said-to-you-is-don-t-leave-me-here
Tracey Emin,Self-Portrait,1994,"Tracey Emin's 'Self-Portrait' was created during the early 1990s, a transformative period in contemporary British art. Emin, a pioneering figure of the Young British Artists (YBAs), often infuses personal experiences into her work, using art as a vehicle for introspection and a means to explore themes of identity, personal history, and emotional expression. The early 1990s marked a significant increase in Emin's exploration of autobiographical content, which became a hallmark of her work. 'Self-Portrait,' like much of her oeuvre, challenges conventional notions of portraiture by emphasizing raw emotion and vulnerability, often through minimalist techniques that focus on line work and simplicity. The work exemplifies the confessional style that has set Emin apart from her contemporaries, using art as a candid mirror of her life experiences. Her self-portraits are not just representations of her physical self but encapsulate her mental and emotional state, thus offering a narrative rich in authenticity and intimacy. Created in a time of burgeoning technological advances and global cultural shifts, this piece reflects the personal amidst the universal, a theme resonant with audiences worldwide for its stark honesty.","White Cube Gallery, London, UK",self-portrait
Tracey Emin,Why I Never Became a Dancer,1995,"Tracey Emin's 'Why I Never Became a Dancer' is a video artwork created in 1995, during a period when the Young British Artists (YBAs) were gaining major recognition in the contemporary art scene. This artwork is often categorized within the conceptual art movement and is emblematic of Emin's deeply personal and autobiographical style. The piece combines narrative and visual storytelling to explore themes of desire, rejection, and liberation. Emin narrates her adolescent experiences in Margate, detailing her aspirations to escape through dance, only to be jeered during a competition by local boys. The work culminates with footage of an adult Emin dancing freely, symbolizing resilience and liberation from her past. This piece exemplifies Emin's use of confessional art to challenge traditional boundaries of narrative and emotion in visual art. It also highlights her broader impact on contemporary art by intertwining personal history with universal themes such as shame and empowerment. 'Why I Never Became a Dancer' reflects the socio-cultural milieu of the 1990s, addressing issues of female agency, identity, and the cultural dimensions of empowerment.","Tate Modern, London, United Kingdom",why-i-never-became-a-dancer
Clyfford Still,PH-959,1950,"PH-959, painted by Clyfford Still in 1950, is a seminal work of the Abstract Expressionist movement, characterized by its vast, raw expanses of color and jagged forms that evoke themes of existential struggle and transcendence. As one of the leading figures of Abstract Expressionism, Still was known for his commitment to producing emotionally charged works with minimal references to recognizable forms. This painting reflects the post-World War II period, capturing a desire for new beginnings and emotional expression following the trauma of the war. Through the use of large-scale canvases and a heavily impastoed surface, Still achieved an intensity that heavily influenced contemporaries such as Mark Rothko and Jackson Pollock. The painting’s significance lies in its pioneering approach to abstraction, moving away from European influences and aiming to express the uniquely American experience. PH-959 exemplifies Still’s signature style of interlocking jagged color fields that create an energetic tension, suggesting both emotional and metaphysical exploration.","Clyfford Still Museum, Denver, USA",ph-959
Clyfford Still,PH-147,1952,"PH-147 was painted in 1952, during a vibrant period of the Abstract Expressionist movement, which emerged in post-World War II America. Clyfford Still is considered one of the founding figures of this movement, alongside artists such as Jackson Pollock and Mark Rothko. Unlike his contemporaries, Still's work is marked by vast color fields and jagged forms that convey a sense of raw emotional power and untamed energy. PH-147 exemplifies Still's signature technique of layering thick oil paint to create texture and depth, allowing the colors to convey intensity and emotion. This painting features the dark, bold color palette and dynamic brushwork typical of Still’s style, often interpreted as reflecting existential themes and the tumultuous spirit of the era. PH-147, like much of Still’s oeuvre, was a departure from traditional representation, embodying Instead pure abstraction as a means of personal expression. In art history, this work is significant for its contributions to Abstract Expressionism’s focus on subjective experience and innovation in color and form, influencing subsequent generations of artists.","Clyfford Still Museum, Denver, USA",ph-147
Clyfford Still,PH-118,1947,"Clyfford Still's PH-118, created in 1947, is a seminal work of Abstract Expressionism, a movement that emerged in post-World War II America. This painting reflects Still's unique approach to abstraction, characterized by large, jagged fields of color and a distinct lack of representational forms, intending to evoke a sense of the sublime. The year 1947 was pivotal for Still as he developed a more mature stylistic language that emphasized the power of raw emotional expression, distancing his work from European Cubism and Surrealism influences. The cultural atmosphere following the war, marked by existential introspection and a search for new meaning, greatly influenced Still and his peers at the New York School, including artists like Jackson Pollock and Mark Rothko. PH-118 is noted for its monumental scale and the dramatic contrast between red and yellow against a darker background, suggesting stark horizons or geological formations, thereby evoking the natural world. This work exemplifies Still's philosophy that art should be about an immersive and visceral experience, devoid of references to external reality. His paintings significantly impacted the direction of modern art, influencing subsequent generations of artists who sought to express the ineffable aspects of human experience.","Clyfford Still Museum, Denver, Colorado, USA",ph-118
Clyfford Still,PH-401,1957,"Clyfford Still was a pivotal figure in Abstract Expressionism, a movement characterized by large-scale, non-representational canvases that emphasize spontaneous, automatic, or subconscious creation. ""PH-401,"" painted in 1957, encapsulates the distinctive features of Still's mature style. During this period, Abstract Expressionism was thriving in post-war America, supported by an interest in personal expression over traditional forms. Still's canvases are marked by their monumental scale and bold use of color, intending to evoke an emotional response rather than depict objects. His work often eschews both representational forms and gestural brushwork typical of his contemporaries, opting instead for jagged fields of color that seem to push beyond the edges of the canvas. The cultural significance of ""PH-401"" lies in its challenge to viewers to engage with the pure essence of paint and color to elicit an individual response. The spontaneity and rawness are indicative of the post-war American search for identity, freedom, and individuality, with an emphasis on personal experience and perception over societal norms.","Clyfford Still Museum, Denver, Colorado, USA",ph-401
Clyfford Still,PH-1030,1951,"Clyfford Still's painting PH-1030, created in 1951, represents a pivotal moment in the Abstract Expressionist movement, a groundbreaking style that emerged in post-World War II America. Still, along with contemporaries like Jackson Pollock and Mark Rothko, pioneered this movement characterized by a focus on conveying emotion and emphasizing the act of painting itself. PH-1030 is emblematic of Still's mature style, notable for its jagged, expansive fields of color that seem to erupt from the canvas. These works often convey a profound sense of drama and tension, which Still believed was an expression of the human condition. His technique of using a palette knife to layer thick, impasto colors created dynamic, textured surfaces that distinguished his works from other abstract forms. Unlike many contemporaries, Still avoided representational elements entirely, striving instead to capture a visceral, immediate impact. The period when PH-1030 was created was marked by Still's departure from New York to a more isolated existence, suggesting a turn towards introspection and autonomy in his artistic practice. This painting contributes significantly to the understanding of Abstract Expressionism by foregrounding its interpretative openness and emotional depth.","Clyfford Still Museum, Denver, United States",ph-1030
Henri Matisse,The Dance,1910,"Henri Matisse painted 'The Dance' in 1910 during a transformative period for modern art. This work, commissioned by Russian industrialist Sergei Shchukin, reflects Matisse's keen interest in capturing the essence of movement and emotion through bold color and form. The painting depicts five nudes in a circle, engaged in a dynamic dance on a backdrop of intense red, green, and blue. 'The Dance' stands as a prime example of Fauvism, a movement characterized by vibrant color and expressive brushwork. Its seemingly simplistic form belies a complex understanding of human movement and emotional expression, conveying a sense of primal joy and unity. Matisse's use of color here is not merely decorative but structural, replacing traditional chiaroscuro modeling to suggest depth and dimension. In terms of significance, 'The Dance' is seen as a pivotal work in Matisse's career and modern art, showcasing his departure from impressionist traditions and his push towards abstraction. Its creation amidst pre-World War I Europe, a time of political tension and artistic upheaval, adds to its historical importance, representing a quest for emotional and artistic liberation.","The Hermitage Museum, Saint Petersburg, Russia",the-dance
Henri Matisse,Woman with a Hat,1905,"Henri Matisse painted 'Woman with a Hat' in 1905 during a seminal period for the development of Fauvism. This art movement, characterized by bold colors and strong, expressive brushwork, was emerging as a reaction against the subdued palettes and representational qualities of Impressionism. Inspired by a focus on emotion and vivid expression, Matisse utilized vibrant colors that deviate from realism, choosing instead to convey the dynamic energy he felt. 'Woman with a Hat,' a portrait of Matisse's wife, Amélie, was exhibited at the 1905 Salon d’Automne in Paris, a pivotal event that marked the public debut of Fauvism. The bold use of non-naturalistic color and loose, painterly brushstrokes were shocking to contemporary audiences but signaled a new freedom in art that prioritized emotional resonance over representational accuracy. The painting represented a radical departure in the use of color and was part of Matisse's ongoing exploration of light and tone as purely aesthetic elements. It played a key role in establishing Matisse as a leading figure in modern art and demonstrated the dramatic expressive potential of color, influencing subsequent movements, including German Expressionism.","San Francisco Museum of Modern Art, San Francisco, USA",woman-with-a-hat
Henri Matisse,The Red Room,1908,"Henri Matisse created 'The Red Room' in 1908 during a pivotal period in his career and modern art history. This painting is a quintessential example of Fauvism, a movement characterized by bold, vibrant colors and expressive brushwork that challenged conventional perspectives of form and color. Matisse was inspired by Post-Impressionist artists like Paul Gauguin and Vincent van Gogh, whose use of color as a tool of expression rather than representation was revolutionary. The painting features a dining room, where a red patterned tablecloth and wallpaper merge seamlessly, creating a flat, decorative surface that defies traditional perspective and depth, signifying Matisse's break from realistic representation. The artwork is renowned for its rhythmic composition and its lush, intense Mediterranean color palette, mirroring Matisse's enthusiasm for light and color. Its significance in art history lies not only in its aesthetic but also in its role in influencing modern design and art, emphasizing the emotional power of color and form over realistic representation.","The Hermitage Museum, Saint Petersburg, Russia",the-red-room
Henri Matisse,The Snail,1953,"Henri Matisse's 'The Snail' was created in 1953 during the later years of his life when he had turned to collage due to his declining health. This technique, known as 'cut-outs,' became a pivotal part of his work, allowing him to explore vibrant color and form with pieces of painted paper. 'The Snail' is a quintessential example of this method, characterized by its abstract representation of a snail through a spiral configuration of bold, colorful shapes. This work reflects Matisse's ongoing interest in simplifying forms and is often seen as a culmination of his experiments with color and composition. At that time, Matisse's approach was considered innovative for its seamless integration of painting and sculpture through paper media. The cultural context included a post-war era where artists were exploring new means of expression, and Matisse's cut-outs would have a significant impact on the development of modern art, influencing movements like Abstract Expressionism and beyond.","Tate Modern, London, United Kingdom",the-snail
Henri Matisse,Harmony in Red,1908,"Henri Matisse's ""Harmony in Red,"" also known as ""The Red Room,"" was painted in 1908 during the period when Fauvism was reaching its peak. This movement was characterized by bold, non-naturalistic colors and expressive brushwork, which Matisse embodied fully in this work. The painting was initially intended to be ""Harmony in Blue,"" but Matisse altered the color to red, creating a more intense and warm composition. This work is significant as it demonstrates Matisse's masterful use of color to create emotion and fill the space with a sense of harmony and energy. The scene depicts a domestic interior with a table laden with fruit, a vase of flowers, and a window overlooking a garden, but the real subject is the color itself and the interplay of patterns creating both depth and flatness. Culturally, Matisse was searching for a new method to express modern life through decorative and ornamental internal scenes. His approach challenged traditional perspectives, emphasizing decorative beauty with simplicity of form and color.","State Hermitage Museum, Saint Petersburg, Russia",harmony-in-red
